provider,name,website,investment_term,loans_rate,min_size,max_size,focus,status,country,location,organisation_type,provider_type,region
Bridges Ventures,Social Entrepreneurs Fund,http://bridgesventures.com/social-sector-funds/social-entrepreneurs-fund/,,,300000,1500000,"The Bridges Social Entrepreneurs Fund aims to address the funding gap often faced by fast growing social enterprises looking to scale. This fund offers flexible and tailored investment in the form of quasi-equity and equity for fast growing UK based social enterprises. It does not offer grants. Businesses with a clear social mission and demonstrable ability to scale. Investment criteria:
Invests in charities and social enterprises with:

i) A clear social mission
ii) A robust  business model
iii) The ability to scale social impact
iv) A strong management team",0,England,NULL,NULL,Equity,United Kingdom
Bridges Ventures,Social Impact Bond Fund,http://bridgesventures.com/social-sector-funds/social-impact-bond-fund/,,,0,3000000,"The  Bridges Social Impact Bond fund was launched in April 2013 with Big Society Capital as cornerstone investor, alongside Omidyar Network and Panaphur, and a co-investment agreement with the Bridges Social Entrepreneurs Fund. The fund provides investment and support to charities and social enterprises delivering  intervention programmes which significantly improve social outcome",0,England,NULL,NULL,Loans,United Kingdom
Ecology Building Socierty,Sustainable Mortgages,https://www.ecology.co.uk/mortgages/community-and-commercial-mortgages/sustainable-business/,,,0,1000000,"Mortgages are available for established environmental businesses, registered charities and voluntary organisations, community owned enterprises, fair-trade businesses and ecological property developers using green, eco -techniques or carrying out renovations in sustainable manner. Organisations must be already established – will not provide loan finance to start-ups",1,England,NULL,NULL,Loans,United Kingdom
Key Fund,The Key Fund,http://thekeyfund.co.uk/finance/our-funds/,,,5000,150000,"The Key Fund is a social enterprise offering secured and unsecured loans, grants, equity and quasi-equity for property, asset and equipment purchases, working capital, development capital, risk capital and for other business purposes. Social enterprises; charities; voluntary and community organisations; social businesses; co-operatives/mutuals. The Key Fund is a special kind of funder. We invest in businesses that want to make a difference to their local community and environment. We are constantly developing and finding new funds to distribute to social businesses across the North. We receive funding from a number of large institutions- check out the logos below to see who they are – that we distribute to applicants. Most of our business is in the form of loans. Occasionally we get the opportunity to offer a blended investment- part grant and part loan but never just grants.",1,England,East Midlands,NULL,Grant,United Kingdom
Resonance,Community Share Underwriting Fund,http://www.resonance.ltd.uk/funds/underwriters-club/,,,25000,500000,"The Community Share Underwriting Fund has been developed in response to the growing number of Community Benefit Societies seeking to raise funds through community share issues.  It is operated by our community lending vehicle, Community Land & Finance CIC. Projects approved for support from the Fund will be able to draw down up to 50% of the community share issue target.  They will be able to advertise this underwriting support on launch of the share issue, which helps to boosts confidence among potential retail investors and encourage higher uptake.",0,England,NULL,NULL,Loans,United Kingdom
Resonance,Affordable Homes Rental Fund,http://resonance.ltd.uk/get-investment/affordable-homes-rental-fund-ahrf/,,,0,0,"The Affordable Homes Rental Fund is operated by Resonance's community development finance institution Community Land & Finance CIC.  The primary aim of the Fund is to facilitate delivery of grant-free affordable rental housing by providing development capital and medium term finance to Community Land Trusts or other community-led organisations.
There are a growing number of communities wishing to develop, own and manage their own community housing in order to address the issue of people being unable to afford to rent or buy in their local area. However, current loan finance funds typically only provide around 60-80% of required development capital and so community groups struggle to finance new build developments.  The Fund can overcome this by providing up to 100% of capital required.",1,England,NULL,NULL,Loans,United Kingdom
Social Investments Scotland,SIS CDFI,http://www.socialinvestmentscotland.com/looking-for-investment/,10,,10000,250000,"Third Sector organisations (charities, community and voluntary organisations, not-for-profits and social enterprises) operating in Scotland Key Requirements: Any profits made by your organisation must be reinvested for community benefit Social Investment Scotland (SIS) provides business loan finance from £10k upwards and is aimed at charities, community organisations and social enterprises that might find it difficult to access finance from mainstream providers. Repaid loans are recycled to provide further support to other organisations and rates are fixed throughout the loan period. They offer all purpose loans, bridging loans and property loans (property loans are offered in partnership with Triodos Bank – see section 4.3.v). SIS has also been managing agent for Scottish Investment Fund £30m, which closed in March 2012",1,Scotland,NULL,Non-profit,Loans,United Kingdom
Social Investments Scotland,Social Growth Fund,http://www.socialinvestmentscotland.com/looking-for-investment/our-funds/,,,10000,1000000,"The Social Growth Fund represents a major funding boost for Scotland's social enterprises and third sector organisations as a result of significant new investments from both the Scottish Government and Big Society Capital, the UK wide, independent organisation that has been set up to grow the size of the social investment marketplace. See http://www.socialinvestmentscotland.com/files/7413/9687/8871/Annouce_Stakeholder_QA_FINAL.pdf",1,Scotland,NULL,Non-profit,Loans,United Kingdom
Social Investments Scotland,Investment Readiness Programme,http://www.socialinvestmentscotland.com/looking-for-investment/our-funds/,,,0,0,"In tandem with this new funding, SIS is also announcing the roll-out of a new investment readiness programme, designed to increase the knowledge, awareness and confidence of organisations looking to take on investment.",1,Scotland,NULL,Non-profit,Support,United Kingdom
Social Investments Scotland,All Purpose Loan,http://www.socialinvestmentscotland.com/looking-for-investment/our-funds/,13,8%,10000,1000000,"Repayable up to a maximum of 13 years, our All Purpose Loan has a fixed interest rate and capital payments so you know exactly what your organisation is required to pay each monthIdeal for assisting with capital expenditure, revenue funding, marketing, business development or working capital
Loans range from £10,000 to £1,000,000 with no penalty for partial or full early repayment
Competitive interest rates - currently between 7% and 9% fixed over life of the loan
1% Arrangement fee",1,Scotland,NULL,Non-profit,Loans,United Kingdom
Social Investments Scotland,Bridging Loan,http://www.socialinvestmentscotland.com/looking-for-investment/our-funds/,1,7%,10000,250000,"Short term finance provided at short notice. Used to cover timing issues for receipt of approved grant monies to enable your project to proceed when the secured grant funding is being paid in arrears
Loans from £10,000 to £250,000 with no security normally required
Competitive interest rates - currently fixed at 7%
1% Commitment fee - paid upfront on issue of facility letter
1% Arrangement Fee - paid on first drawdown",1,Scotland,NULL,Non-profit,Loans,United Kingdom
Social Investments Scotland,Triodos Property Loan,http://www.socialinvestmentscotland.com/looking-for-investment/our-funds/,13,8%,30000,1000000,"Working in partnership with Triodos Bank we provide term loans up to a maximum 13 years (see note 1)Ideal for assisting with all types of property purchase, refurbishments or major capital spends Triodos provide up to 70% Loan To Value or purchase price (whichever is the lower) and SIS can provide up to the remaining 30% of the loan even if you don't have any equity
SIS Loans range from £30,000 to £1,000,000 depending on percentage split
Competitive interest rates - currently between 7% and 9% fixed over life of the loan (see note 2)
Our arrangement Fee - 1% of SIS borrowing (see note 3)
1. Triodos can provide loans for up to 25 years.
2. Triodos interest rates and fees to be agreed by them.
3. Tridos arrangement fee subject to circumstances.",1,Scotland,NULL,Non-profit,Loans,United Kingdom
CAF Venturesome,SE Assist,https://www.cafonline.org/charity-finance--fundraising/borrowing/social-investment/se-assist,,0%,10000,30000,"SE-Assist is a regional programme, managed by CAF Venturesome, which provides a comprehensive package of support to help early-stage social enterprises thrive. SE-Assist gives organisations access to affordable working and development capital, along with dedicated business expertise to help them grow.SE-Assist currently has funds in Sussex and Croydon, with more funds in other regions coming soon.
Key features of the SE-Assist Fund

Successful social enterprises in the SE-Assist regions receive a support package which includes an interest free loan of between £10,000 and £30,000, an experienced mentor from a leading local company and access to a bank of experts. SE-Assist also supports the creation of local social enterprise networks, allowing applicants to access peer-to-peer learning and best practice.
Criteria

To be eligible for the SE-Assist Fund, social enterprises should:
be based within one of our SE-Assist fund regions
have a social impact that addresses a local social or environmental need
have an annual turnover of less than £500,000 p.a. (over the last three years) for the organisation, or specific initiative, for which you are applying
have borrowing powers as defined in your constitution
be willing to engage in the ongoing learning and development process to improve the SE-Assist proposition
have, or be working towards, a sustainable business model
be seeking support for organisational growth or sustainability
have a clearly defined need for the support package
be able to demonstrate how the support package will help to achieve the aims set out
be able to clearly outline how financial support will be used and repaid",1,England,NULL,NULL,Support,United Kingdom
CAF Venturesome,Development Fund,https://www.cafonline.org/charity-finance--fundraising/borrowing/social-investment/development-fund,,6.5%,25000,350000,"The Development Fund provides affordable, repayable finance to help high impact charities and social enterprise build their capacity and allow them to thrive. It provides finance from £25,000 to £250,000 in the form of unsecured loans.In the last six years CAF Venturesome has loaned over £8.5m from the Development Fund across a wide range of sectors, with an average loan size of £100k.",1,England,NULL,NULL,Loans,United Kingdom
CAF Venturesome,Social Impact Fund,https://www.cafonline.org/charity-finance--fundraising/borrowing/social-investment/caf-social-impact-fund,,,25000,350000,"The CAF Social Impact Fund lends capital to social organisations that would otherwise have few finance options. It provides finance from £25,000 to £350,000 in the form of unsecured loans.
Since its inception four years ago the CAF Social Impact Fund has lent over £5million.

The Social Impact Fund provides finance in three critical areas:

i) Working capital
ii) Underwriting facility – standby facilities that provide a safety net to social organisations
iii) Bridging loan –which can help your organisation manage working capital between receipts of committed but delayed income such as grants

Before providing financial support we conduct robust due diligence on your organisation, which involves (and is not restricted to) looking at strategy, current and historic finances and governance and management. We look for organisations to demonstrate a degree of social impact in order to qualify for financing.",0,England,NULL,NULL,Loans,United Kingdom
CAN Invest,CAN Early Intervention Fund,http://can-invest.org.uk/social-investment/social-enterprise/funds-investment/can-early-intervention-fund,,4%,5000,100000,"The Early Intervention Fund is a new fund launched by CAN to accelerate positive early intervention impact on communities and individuals in London. The fund will provide loans and business support to VCSE organisations who deliver innovative, demonstrably effective products and services in the ‘early intervention’ space for the benefit of children and young people. We have defined Early Intervention (EI) as: “programmes that support targeted action to prevent social cost and personal harm for children and young people.”",1,England,London,For-profit,Loans,United Kingdom
CAN Invest,Investment & Contract Readiness Services,http://can-invest.org.uk/social-investment/social-enterprise/investment-readiness,,,0,0,"CAN Invest is an Approved Provider for the Investment and Contract Readiness (ICR) Fund, a £10m fund managed by The Social Investment Business (SIB), which aims to support social ventures of all kinds that tackle social problems, are financially sustainable and want to scale up.",1,England,NULL,For-profit,Support,United Kingdom
Impetus,Private Equity Foundation,http://www.impetus-pef.org.uk/how-we-work/investing-in-charities/,,,50000,500000,"Our programmes are transforming the life chances of disadvantaged young people, through advancing educational attainment and improving their employability skills.
1) Educational attainment: Helping young people plan and fulfil their academic potential, with the subject frameworks, study skills and confidence to success in their chosen pathway.
2) Employability skills: Helping young people move successfully from school to employment, with support to develop personal skills and gain experience in the workplace.

Our approach at Impetus-PEF is to work with organisations in depth and typically over a number of years. We work closely and collaboratively with the leaders of each of our portfolio charities, supporting them to build high-impact organisations.

In the first instance, we look for promising charities and social enterprises that aim to effect far-reaching change for the young people they help. We perform rigorous due diligence before deciding to support them.

We manage our partnerships with charities in a series of phases:

- Before we start each phase, we agree a programme of work, financial commitment, duration and set of milestones with the charity
- At the end of each phase, we assess and agree with the charity whether it is ready and committed to progress to the next phase of investment
- Each phase leads to positive tangible results for the charity and increased impact for the young people that the charity serves.

Where the evidence shows that its programmes lead to lasting and meaningful change, we help the charity to expand significantly – and in doing so, enable it to increase dramatically the number of young lives it is in a position to transform.",1,England,NULL,Non-profit,Grant,United Kingdom
Inspiring Scotland,Social Funds,https://www.inspiringscotland.org.uk/what-we-do/thematic-funds/,,,0,0,"We have a number of funds running concurrently, each has a very clear focus and is tackling a different area of social need.  Our focus to-date, has been on tackling youth unemployment, increasing play opportunities for children, improving early years support and helping to empower people living in our most vulnerable communities improve their lives.  
Our robust performance management means we are able to demonstrate the difference each fund is making. Individual funds will run for a set time period, so we will have a rolling programme of different funds starting as others reach their natural end point.

Current Funds

14:19 Fund - Our first and longest running fund, established in 2009, is performing well in supporting young Scots to make a successful transition from school into education, training and employment.
Go2Play - builds on the success of the two year Go Play programme, invests in a small portfolio of play ventures to support the expansion of play rangers.
Link Up - is a new model of community building that helps individuals and communities create solutions to lcoal issues.  It's working with some of Scotland’s most disadvantaged communities to encourage residents to come together, build new relationships and start to address the challenges they face.",1,Scotland,NULL,Non-profit,Grant,United Kingdom
Social Business Trust,Social Business trust,http://www.socialbusinesstrust.org/how-to-apply,,,0,3000000,"Social enterprises that are registered charities, have a proven track record and ambitious plans; must have annual revenue in excess of £1 million, be at least 12 months old and help at least 1000 people a year through their services (directly or indirectly). Social Business Trust works with social enterprises capable of scaling up their operations on a regional and national level to become investment ready and attract funds from its corporate partners. Through its corporate partners, the Social Business Trust works with social enterprises to take a long-term view towards financial sustainability, skills development, due diligence, and investment. The trust aim to invest in five social enterprises per year. The organisation should be registered as a charity or demonstrate a clear charitable purpose",1,England,NULL,Non-profit,Grant,United Kingdom
Venture Partnership Foundation,Venture Growth Model,http://www.vpf.org.uk/about-us/,,,0,0,"Our expert due diligence, based on the record of our Members in backing winners in both the commercial and social sectors, identifies up-and-coming social entrepreneurs with a proven model and the ambition to scale.
We back them to become even more effective, with a combination of financial support and professional expertise from the private sector.

Established by a membership of private and institutional funders, VPF’s pioneering model leverages primarily unrestricted grants with private sector pro bono support and access to members' networks.

This facilitates growth and ultimately maximises social impact.

Our mission is to:

- Increase and redistribute the amount of money being directed towards social innovation;
- Become the lead donor of choice to social entrepreneurs and the dynamic organisations that they run;
- Promote engagement of the commercial sector in the activities of social entrepreneurship;
- Positively influence the way in which the charitable and social enterprise sector is perceived by the commercial sector.",1,England,NULL,For-profit,Grant,United Kingdom
Abundance Generation,Abundance Generation Crowdfunding Platform,https://www.abundancegeneration.com/,,,0,0,Provides a crowd-funding platform for raising money in renewable energy projects.,0,England,NULL,For-profit,Loans,United Kingdom
Better Place,Better Place Online Fundraising,https://www.betterplace.org/en/collect-donations/online-fundraising,,,0,0,"Online donation platform. If you want to gain the long-term loyalty of your donors you need a convincing strategy – and authentic and personal communication. On betterplace.org supporters can experience your project: By posting news and adding pictures or videos, you can instantly provide your supporters with updates on the progress of your project. You can also segment your donors and send a customized newsletter to each group in order to encourage them to donate again. You will profit from the efficiency of our communication system. And your givers might want to donate again, again, and again...",1,England,NULL,For-profit,Grant,United Kingdom
Fundit.Buzz,Former Buzz Bank Crowdfunding Platform,https://fundit.buzz/,,,0,0,Buzzbnk is an on-line crowd-funding platform bringing social ventures looking for start-up or growth capital together with like-minded people keen to participate in a new way of funding social change. It's a whole new way to do good with your money.,1,England,NULL,For-profit,Grant,United Kingdom
Crowdcube,Crowdcube Crowdfunding Platform,https://www.crowdcube.com/,,,0,0,"Crowdcube is the world’s leading investment crowdfunding platform. We enable anyone to invest alongside professional investors in start-up, early stage and growth businesses through equity, debt and investment fund options.Join the 200,000-strong crowd looking for more interesting investments - it’s free, quick and has no obligations.",1,England,NULL,For-profit,Loans,United Kingdom
Crowdfunder,Crowdfunder Crowdfunding Platform,http://www.crowdfunder.co.uk/,,,0,0,"Crowdfunder turns great ideas into reality, by connecting people, projects and partners. Crowdfunder has raised millions for businesses, social enterprise, charities and individuals - and unlocked millions more through match funding and support. Our investors include Nesta, Creative England, Plymouth University and Crowdcube.",1,England,NULL,For-profit,Grant,United Kingdom
Crowdfunder,Community Shares Campaign,http://www.crowdfunder.co.uk/communityshares,,,0,0,A platform where you can place your project to raise money for community share offers.,1,England,NULL,For-profit,Platform,United Kingdom
Ethex,Ethex Crowdfunding Platform,https://www.ethex.org.uk/,,,0,0,Crowd funding for social enterprises & non-profits,1,England,NULL,For-profit,Loans,United Kingdom
Just Giving,Just Giving Donation Platform,https://home.justgiving.com/,,,0,0,"UK-registered charities or organisations with a GiftAid number, including schools, churches, community amateur sports groups and scout and guide groups",1,England,NULL,Non-profit,Grant,United Kingdom
Funding Circle,Crowdfunding Platform,https://www.fundingcircle.com/uk/,5,,5000,1000000,"Funding Circle is the world’s leading marketplace exclusively focused on small businesses - more than $500m (£300m) has been lent to 5,000 businesses. Today, businesses can borrow directly from a wide range of investors, including more than 30,000 people, the UK Government, local councils, a university and a number of financial organisations.",1,England,NULL,For-profit,Loans,United Kingdom
Kickstarter,Crowdfunding Platform,https://www.kickstarter.com/,,,0,0,"Kickstarter helps artists, musicians, film-makers, designers, and other creators find the resources and support they need to make their ideas a reality. To date, tens of thousands of creative projects — big and small — have come to life with the support of the Kickstarter community.",1,England,NULL,For-profit,Grant,United Kingdom
Kiva,Zip,https://zip.kiva.org/borrow,,,0,0,"We are a non-profit organization with a mission to connect people through lending to alleviate poverty. Leveraging the internet and a worldwide network of microfinance institutions, Kiva lets individuals lend as little as $25 to help create opportunity around the world.",1,England,NULL,For-profit,Loans,United Kingdom
Space Hive,Crowdfunding Platform,http://spacehive.com/,,,0,0,Spacehive helps communities transform their local public spaces by providing a crowd fiunding site specifically focused on finance for the improvement of civic spaces.,1,England,NULL,Non-profit,Grant,United Kingdom
Charities Trust,Crowdfunding Platform,https://www.sponsorme.co.uk/sponsor-me.aspx,,,0,0,"Charities Trust is the most innovative donations management company in the UK, working with companies, individuals and charities to grow the giving market. 
CT Donate is the online platform that is home to Charities Trust's key fundraising tools. From here you can set up a Sponsor Me fundraising page or manage a My Giving Account.",1,England,NULL,For-profit,Grant,Europe ex UK
Start Some Good,Crowdfunding Platform,http://startsomegood.com/,,,0,0,"StartSomeGood is a for-profit social enterprise with a revenue model that aligns directly with those of the social entrepreneurs using our site. Because we only receive funds ourselves if our ventures succeed, we provide a high-touch experience, guiding social entrepreneurs along their StartSomeGood journey from the moment they apply to be a venture, to smashing funding goals and beyond. Success on StartSomeGood is a win-win-win situation: our ventures receive the captial they need to transform their ideas into action and impact; supporters know that their funds go to creating new tangible good in the world; and StartSomeGood continues to grow and support more social innovation.",1,England,NULL,For-profit,Grant,United Kingdom
Zopa,Peer to peer lending,http://www.zopa.com/,,,0,0,"Zopa is the pioneer of peer-to-peer lending, which uses the internet to cut out the banks entirely. It matches savers with individuals who want to borrow, leaving out the bank and offering better rates all round.",1,England,NULL,For-profit,Loans,United Kingdom
Cooperative and Community Finance,Community Loan Fund,https://coopfinance.coop/borrow/,,,10000,150000,"We lend to organisations that are owned and democratically controlled by their members, who are usually either employees, customers or members of a community. Loans from £10,000 to £75,000 are readily available, and we are able to lend up to £150,000 using other funds. We do not require personal guarantees. We manage a range of loan funds throughout the UK, and currently have around £4m available to lend. Our staff will be glad to advise on the availability of specific funds and the most suitable forms of finance for your business.",1,England,NULL,For-profit,Loans,United Kingdom
