provider,name,website,investment_term,loans_rate,min_size,max_size,focus,status,country,location,organisation_type,provider_type,region
RSA,Catalyst Program,https://www.thersa.org/fellowship/project-support/,,,1000,10000,"At the RSA, we believe that everyone should have the power to turn their ideas into reality. Our Catalyst Program was set up to do exactly what its name suggests: to catalyse new ideas into scalable projects. The program offers grants, support for crowdfunding with RSA Kickstarter, and help with utilising the expertise within the Fellowship to make your project a success.
Offers are:

1) Small Catalyst Grants of £1,000 - £2,000: These grants are for new projects that are in their early stages, and in need of a financial boost to help them develop into a sustainable project which will deliver impact. We will always consider truly outstanding proposals that fall outside the scope of our three key themes.
2) Scaling Catalyst Grants of £10,000: These grants are for exceptional projects addressing one of our three key themes that have clearly demonstrated their proof of concept and are ready to scale up. We offer a limited number of £10,000 grants and will award to the projects where we feel our grant will have the greatest impact.  
3) Crowdfunding support with RSA Kickstarter: Free monthly webinars and exclusive access for Fellows to training events at RSA House, with the possibility of having your project featured on RSA Kickstarter. The success rate of projects on RSA Kickstarter is double the Kickstarter average. 

In order to be considered for a grant:

a) Your project should be led by an RSA Fellow who will be the main point of contact with the RSA
b) Your project should demonstrate clear impact and the potential to be sustained in the long term
c) For Small Catalyst Grants the project should be new 
d) For Scaling Catalyst Grants the project does not need to be new or have received prior funding from the RSA, but must demonstrate a clear proof of concept.",1,England,NULL,For-profit,Grant,United Kingdom
Institute of Enterprise & Entrepreneurship,Business Support,http://www.ioee.co.uk,,,0,0,"Our purpose is to support our members in developing and continuously improving their enterprising skills allowing them to maximise both their personal potential and their wider contribution to the growth and success of UK PLC.
We have more than 30,000 members from across the spectrum of enterprise activity – students who have yet to start a business, entrepreneurs in the early stages of running their business, business owners looking to grow their business, managers working in an enterprising way, mentors and support professionals, and recognised learning providers.

We offer enterprise related training and qualifications, enterprise events and enterprise resources working with a range of private and public sector partners and delivering through a network of Centres of Enterprise Excellence and Enterprise Academies.",1,England,NULL,For-profit,Support,United Kingdom
RSA SkillsBank,Business Support,https://www.thersa.org/fellowship/get-involved/,,,0,0,"We welcome all levels of support from our Fellows. You can connect with a powerful network of like-minded people, start a new social change initiative, watch our amazing events online and read our journal. 

However you decide to participate, you will be part of a movement that is enriching society through ideas and action.

If you're not already an RSA Fellow and you support our mission of 21st century enlightenment, find out more about joining us.",0,England,NULL,For-profit,Support,United Kingdom
Unltd Pro Bono and Volunteering,Business Support,https://unltd.org.uk/partners/mentoring-social-entrepreneurs/,,,0,0,"Various: in-person, phone, email, LinkedIn group and on-line webinars – in addition, many mentors are employed within large professional services firms (accountants and solicitors)",1,England,NULL,For-profit,Support,United Kingdom
Prince’s Youth Business Trust,Enterprise,https://www.princes-trust.org.uk/help-for-young-people/support-starting-business/enterprise,,,250,5000,"If you’re aged 18-30, living in the UK, and unemployed or working fewer than 16 hours a week and have a business idea or some ideas to explore, then we can help with the rest.From beauticians and barbers to digital agencies and dog groomers, we can help you to transform your idea into a watertight business plan, as well as support you with a fantastic package of training and funding.
You’ll also get to meet other like-minded people and be able to tap into the expertise of an experienced business mentor who will be on hand to provide you with advice every step of the way – for up to two years.",1,England,NULL,For-profit,Loans,United Kingdom
UK Business Labs,Business Support,http://www.ukbusinesslabs.co.uk/forums/,,,0,0,"On-line forum of small businesses – grouped around various themes and issues; a useful way to gather a range of ideas and responses to specific questions or issues. Not all business & social networks are the same. UK Business Labs brings people together and makes blogging, networking, discussion and marketing easy and effective. The software is used by tens of millions of people worldwide so it's simple to use too. UK Business Labs integrates with Twitter, Facebook, Google+, LinkedIn, WordPress, Tapatalk and countless other social media tools; which enables you to share your content quickly. You'll need to register before you can post but registration and basic membership is absolutely FREE.",1,England,NULL,For-profit,Support,United Kingdom
Enterprise Rockers - ProBeat,Business Support,http://www.enterpriserockers.co.uk/probeat.php,,,0,0,"Enterprise Rockers is a ‘network of networks’ – we are a free to join in band of people who get together through online and offline networking, linking those that engage with us to existing organisations that can help them if necessary. Social Media, Micro Biz Matters Day events or informal interaction where you live is all part of ensuring micro business owners see the benefits of being involved with a band of people that are doing it for themselves and ensuring they are rocking the global economies by creating the ‘Power of Plenty’.If you employ between 0 & 9 people you are a micro business owner and that makes you an Enterprise Rocker – come and join the band!",1,England,NULL,For-profit,Support,United Kingdom
Organisation for Responsible Business,Business Support,http://www.orbuk.org.uk/,,,0,0,"Are you fed up with ""business as usual?"" Are you one of the growing numbers of small UK-based business owners who are committed to operating ethically and responsibly? Do you care about people and the environment and make business decisions accordingly? Is being transparent, honest and authentic a top priority?If that's you, congratulations and welcome to our world.
Now is the time to clearly demonstrate that you are part of a movement that encourages a better way of doing business. Become a member of the Organisation for Responsible Businesses (ORB) and use the Responsible Business Member logo with pride!

By working together, we can make a difference. Together we can drive this movement and ensure small businesses become the ethical engine room of the UK.
Our members are also featured in the Responsible Business Directory, and because we love to see small businesses thrive and prosper as much as we love making a positive difference to society, our clever inbuilt SEO helps many of our members get their ORB member profile pages on to page 1 of Google.",1,England,NULL,For-profit,Support,United Kingdom
MentorsMe,Business Support,http://mentorsme.co.uk/,,,0,0,Website profiles various providers of mentoring support – grouped by geographic area or stage of enterprise development,1,England,NULL,For-profit,Support,United Kingdom
BITC,ProHelp,http://www.bitc.org.uk/programmes/prohelp,,,0,0,"Established by Business in the Community in 1989, ProHelp is a network of professional firms who are committed to making a difference in their community by offering their services for free to community organisations in need of support. It now involves more than 400 professional firms across the UK.
ProHelp is the UK’s only multi-sector professional firm network and as such both provides members with opportunities to meet with and work alongside other professions, and acts as a valuable 'one-stop' resource to community organisations seeking support.",0,England,NULL,For-profit,Support,United Kingdom
Mowgli Foundation,Business Support,http://www.mowgli.org.uk/,,,0,0,"Mowgli is an award winning, UK-headquartered mentoring organisation founded to support the sustainable development of societies through the mentoring and evolution of entrepreneurs and leaders.
What we do
Mowgli provides mentoring that inspires, connects and guides entrepreneurs and leaders to overcome life's personal and business challenges.",1,England,NULL,For-profit,Support,United Kingdom
National Enterprise Network,Business Support,http://www.nationalenterprisenetwork.org/,,,0,0,"National Enterprise Network is a unique membership body representing the enterprise support sector across England.
We believe our members are crucial to England's economic growth and our role is to support their work. We represent their interests, promote the results they achieve and connect them with opportunities for even greater success. Find out more about membership. 

Membership is open to any organisation involved in the support and development of enterprise in England.",1,England,NULL,For-profit,Support,United Kingdom
Prowess 2.0,Business Support,http://www.prowess.org.uk/category/starting-and-growing-a-business/support,,,0,0,Website providing various free guides to national networks of both support & finance for women-focused enterprise networks.,1,England,NULL,For-profit,Support,United Kingdom
Mi enterprise,Business Support,http://www.mienterprise.org.uk/index.html,,,0,0,"Various – MiEnterprise is structured as a marketing co-operative to support individuals (usually with a disability) into self-employment. We work with individual people who want to start their own business. Sometimes these are called micro-enterprises. Is doesn’t matter how small the businesses are.Work is important for all sorts of reasons, money is just one of those things. A micro-enterprise can still give you all those other important things without earning a lot of money. They include how good you feel about yourself, how many people you know in your community, your relationship with them, and your sense of doing something for yourself.

We are finding already that miEnterprise can offer something to people who thought that they could never get paid, and that it can be a real alternative to day services to support more people into work. We think that miEnterprise can help in using some of the things we already have (resources like people, buildings, equipment) differently to help people get into work.",1,England,NULL,For-profit,Support,United Kingdom
UnLtd,Care to Change,https://unltd.org.uk/care-to-change/,,,,,"UnLtd is looking for social entrepreneurs who have innovative ideas to support adults living with physical, mental and learning disabilities in Southwark. You may be just starting out or have already begun to build your venture. You are passionate about supporting adults with social care needs to lead fulfilling lives in the local community. We want to help people develop social business ventures that can create their own income and be sustainable.",1,England,Southwark,Individuals,Support,United Kingdom
UnLtd,Transform Ageing,https://unltd.org.uk/transform-ageing/,,,,,"Transform Ageing aims to revolutionise the approach to health, wellbeing and social care for people in later life, starting in the South West of England.

Bringing together people in later life, social entrepreneurs and commissioners of health and care services, Transform Ageing will define, develop and deliver new people-centred solutions that better support the needs and aspirations of older people. Transform Ageing is Funded by Big Lottery and run in partnership with the Design Council, the South West Academic Health Science Network and the Centre for Ageing Better. We are supporting social entrepreneurs with two awards:

Do It Awards are designed to help you turn your ideas into real ventures.

Grow It Awards provide support to those who have proven their commitment and have successful ventures which are ready to scale or become self sustaining.",1,England,South West,Non-profit,Support,United Kingdom
UnLtd,Spaces for Change,http://youngunltd.org.uk/looking-for-support/spaces-4-change/,,,,5000,"Spaces for Change (S4C) is a UK wide programme that will find, fund, support and connect young people aged 16-24 to start and run social ventures that unlock the potential of unused or under-utilised spaces for the benefit of the local community, especially other young people.  From 2016-2019 100 awards will be available for young leaders consisting of up to £5,000 project funding, a dedicated award manager providing tailored support, cohort support, and peer to peer networking opportunities for sharing knowledge and learning.  Young people aged 18 – 24 will also have the opportunity to crowd fund alongside their award with support from Spacehive. This will enable the young person to demonstrate tangible support from the local community for their idea, learn valuable skills, as well as increasing the chances of sustainability of the social venture. Opens 3rd July 2017, EOI deadline 30th Oct. 2017, Application deadline 11th Dec. 2017.",1,NULL,NULL,Individuals,Grant,United Kingdom
UnLtd,Do It  Awards,https://unltd.org.uk/doit/,,,,,"We support individuals who are:

    Aged 16 or over and living in the UK
    Not part of an established organisation

To be eligible your idea must:

    Have a real social impact
    Fulfil a clear need and demand
    Have clear outputs and goals
    Provide a learning experience or opportunity

Ideas and ventures are not eligible for an Award if they:

    Are part of your paid employment
    Involve political or religious campaigning
    Involve activities outside of the law or against public policy, or anything that encourages ethnic, religious or commercial disharmony
    Involve employing people other than yourself to carry out most of the work
    Are mainly for people to achieve academic qualifications
    Are to fund living expenses",1,NULL,NULL,Individuals,Grant,United Kingdom
UnLtd,Grow It Awards,https://unltd.org.uk/grow-it-award/,,,,15000,"The Grow It Award is for social entrepreneurs looking to scale their venture providing tailored support, access to workshops and networks, and up to £15,000 cash. This Award has replaced our Fast Growth and Build It Awards, combining our experience of helping social entrepreneurs achieve scale.",1,NULL,NULL,Individuals,,
Access,Reach Fund,http://www.reachfund.org.uk/,,,,15000,"The Reach Fund is a two year £4m grant fund that is going to test a new model for investment readiness support. The programme is funded by Access – The Foundation for Social Investment and is open to organisations in England.

Many social investors are approached by charities and social enterprises who require extra support to become 'investment ready’.

Through this programme, social investors can refer these organisations to the Reach Fund to apply for the support they need.",1,England,NULL,Non-profit,Grant,United Kingdom
Plunkett Foundation,Making Local Woods Work,https://makinglocalwoodswork.org/,,,,,"Over the next three years we’ll be working with 50 woodland social enterprises across the UK. We’ll be providing them with a range of support tailored to their individual needs; all fifty will receive four days of specialist support, with the majority then going on to receive at least some further assistance up to a further 12 days of support per group.

We’ll also be making sure there lots of ways that anyone interested in or involved with woodland social enterprise can get involved – from training events and workshops to webinars and national campaigns.",1,NULL,NULL,Non-profit,Support,United Kingdom
Co-operatives UK,The Hive – business support programme,http://www.thehive.coop,,,,,"Online portal with lots of free resources to help you plan and develop your start-up or existing co-operative business idea
Free or heavily discounted training events
One-to-one support
Mentoring
",1,NULL,NULL,Co-operative,Support,United Kingdom
Federation of City Farms and Community Gardens,Growing Together,https://www.growingtogether.community/,,,,,"Growing Together is here to support community growing groups of all kinds from community gardens and city farms to community orchards, wildlife gardens and kitchen gardens. Our remit covers a wide area of topics, including:

    Crowdfunding
    Community Shares
    Generating income through trading
    E-Commerce (Digital Income Generation)
    Procurement
    Business Planning
    Financial Governance
    Finding and securing land

Direct support, events and free online information resources
",1,NULL,NULL,Non-profit,Support,United Kingdom
BBV,Start & Grow,http://bbvonline.net/index.php/start-and-grow,,,,,"So you’ve got a great business idea but are not sure what to do next? The Start & Grow programme is here to support you! Must be located within an approved local authority area.

The Start & Grow programme provides a range of pre and post start support to individuals who have aspirations to start a business and the capability to make the business a success.

This new programme is available to those looking to start a business, that will require start-up funding to get it off the ground and expects to employ people from its early stages.

The support provided through Start & Grow is tailored to the individual needs of the owner and the business idea, but will include one to one support and advice, workshops and training, mentoring and help finding funding. ",1,NULL,NULL,Individuals,Support,United Kingdom
BBV,Virgin Start-up,http://bbvonline.net/index.php/news/virgin-startup,,,500,25000,"Virgin StartUp is a not-for-profit organisation that helps entrepreneurs aged 18 and over in England who are pre-trading or within their first 12 months of consistently trading. In certain circumstances this may be extended to 24 months.

BBV is the local delivery partner of Virgin StartUp in the north-west of England.",1,England,North West,Individuals,Loan,United Kingdom
HM Government,Business is Great,http://www.greatbusiness.gov.uk/,,,,,"Support, advice and inspiration for growing your business",1,NULL,NULL,NULL,Support,United Kingdom
HM Government,Smart Funding,https://www.gov.uk/guidance/innovation-get-details-about-innovate-uk-funding-competitions#smart,,,25000,250000,"Grant levels vary. You can get funding of up to 60% of your project costs to prove that your idea will work or to find a potential market. You can get funding of up to 45% to develop a prototype. You will need to fund the remaining costs yourself.  To qualify for Smart funding you must:

    be an early-stage, micro, small or medium-sized UK business or be thinking of starting a business
    have both the ambition and potential to achieve high growth
    work in science, engineering or technology industries",1,NULL,NULL,NULL,Grant,United Kingdom
HM Government,Patent Box,https://www.gov.uk/guidance/corporation-tax-the-patent-box,,,,,The Patent Box enables companies to apply a lower rate of Corporation Tax to profits earned after 1 April 2013 from its patented inventions. The relief will be phased in from 1 April 2013 and the lower rate of Corporation Tax to be applied will be 10%.,1,NULL,NULL,NULL,Legislation,United Kingdom
The FSE Group,Various,http://www.thefsegroup.com/,,,,,"Our primary goal is to provide tailored funding solutions and support for ambitious and innovative small and medium enterprises (SMEs), to help them achieve their maximum potential. This includes the provision of fund management services, training and consultancy, and the management of business angel networks. We also provide funding and support to businesses and organisations in the social enterprise sector.",1,NULL,NULL,Non-profit,Support,United Kingdom
Big Issue Invest,London Housing Fund,http://bigissueinvest.com/housing-fund/,,,50000,2000000,"With support from the Greater London Authority, Big Issue Invest has launched a new £10 million fund to finance the provision of new affordable housing in London.  We aim to invest the funds into community organisations, social enterprises, charities and smaller housing associations, helping them to renovate empty homes or buildings and convert them into good quality affordable housing for Londoners to rent or part buy.

The fund offers loans of between £50,000 and £2 million to qualifying applicants at competitive rates and flexible terms.  We will consider any proposal from the social sector which creates affordable housing. Exact terms will vary slightly with each proposition, but in practice, we will aim to offer a fixed interest rate. The funds may be used to purchase or refurbish properties and may also be used to pay for professional fees. We are particularly interested in projects that create apprenticeships and job opportunities for people in London.

In celebrating our recent 10th anniversary, we are pleased to be launching a £10 million fund to help transform empty homes into good quality low cost housing. We are also excited about providing long term unemployed people, veterans and out of work young people from across London with the opportunity for employment and training in",1,England,London,Non-profit,Loan,United Kingdom
Resonance,Affordable Homes Rental Fund,http://resonance.ltd.uk/get-investment/affordable-homes-rental-fund-ahrf/,8,5.5 – 7.5%,100000,1200000,"The Affordable Homes Rental Fund will lend up to 100% to Community Land Trusts or other community-led organizations that would like to build affordable homes. Conversions of existing buildings and refurbishment to create affordable homes can also be funded, as can the refinancing of affordable housing for rental after construction.

Quote - Homes for Wells J FergussonThe Fund is open to community-led groups seeking finance for affordable rental housing.",1,NULL,NULL,Non-profit,Loan,United Kingdom
Resonance,National Homelessness Property Fund,http://resonance.ltd.uk/get-investment/national-homelessness-property-fund/,,,,,"The National Homelessness Property Fund provides 1-2 bedroom flats as move-on accommodation, leased to organizations tackling homelessness.

After the success of the Real Lettings Property Fund in London, Resonance believes that this formula of working with homelessness charities and local authorities will work in other areas of the UK, which is why we developed the National Homelessness Property Fund.  The Fund is currently operating in three cities across the UK – Bristol, Oxford and Milton Keynes – with more planned.",1,England,"Bristol, Oxford, Milton Keynes",Non-profit,Equity,United Kingdom
Resonance,Resonance Bristol SITR Fund,http://resonance.ltd.uk/get-investment/bristol-sitr-fund/,6,6%,150000,275000,"Resonance’s first Social Investment Tax Relief (SITR) Fund brings £5m investment to the social enterprise sector in and around Bristol over the next two years.

The Fund offers unsecured loans over a six year term, “interest only” for the first three years..",1,England,Bristol,Non-profit,Loan,United Kingdom
Resonance,Health & Wellbeing Challenge Fund (South West),http://resonance.ltd.uk/get-investment/health-wellbeing-challenge-fund-south-west/,6,7.5%%,50000,150000,"The Health & Wellbeing Challenge Fund (South West) has £5m of new funding available to invest in voluntary, community and social enterprises (VSCEs) in the South West.

The Fund offers investment and operating finance to social enterprises working with people to tackle a range of health and care issues.",1,England,South West,Non-profit,Loan,United Kingdom
Social Investment Scotland,ASDA Community Capital,http://www.socialinvestmentscotland.com/looking-for-investment/our-funds/,,,10000,50000,"ASDA Community Capital is designed to support early stage social enterprises looking to access social investment for the first time. Using money raised through the Plastic Bag tax introduced in Scotland in October 2014, the fund aims to support social enterprises to make the step change they need to increase their social impact and/or financial sustainability.   

ASDA Community Capital has been specifically designed with affordability and flexibility in mind.

    Loans range from £10k to £50k with no penalty for partial or full early repayment
    Repayable over a maximum of 6 years.
    No interest charged or accrued in Year 1.
    No repayments in Year 1 (Interest and capital repayments start from Year 2)
    No security required
    No Arrangement fee.

Update: Apply before the 16th June 2017 to access free social impact support!",1,Scotland,NULL,Non-profit,Loan,United Kingdom
Charities Aid Foundation,The Community Land Trust Fund,https://www.cafonline.org/charities/borrowing/social-investment/community-land-trust,,7.5%,20000,400000,"Provide pre-development finance from £20,000 to £100,000 and development loans up to £400,000 that can be used to:      carry out the work needed to submit planning permission for the scheme     complete the scheme",1,"England, Wales",NULL,Non-profit,Loan,United Kingdom
