provider,name,website,investment_term,loans_rate,min_size,max_size,focus,status,country,location,organisation_type,provider_type,region
Big Lottery,Social Incubator Fund,https://www.biglotteryfund.org.uk/socialincubatorfund,,,50000,15000000,"The £10 million Social Incubator Fund is being delivered by the Big Lottery Fund on behalf of the Office for Civil Society (OCS). It aims to help drive a robust pipeline of start-up social ventures into the social investment market, by increasing focus on incubation support, and attracting new incubators into the market. This is not funding for frontline social ventures; the Social Incubator Fund provides grants to social incubators, a portion of which forms an investment book which must be invested in social ventures using non-grant financial structures.
The first round of the Social Incubator Fund launched in July 2012, and was aimed at established social incubators based and operating primarily in England. You can read more hereGoes to different websiteOpens in new window The second round, which was also open to newer social incubators, launched in May 2013. The Social Incubator Fund is currently closed to applications, as all of the initial £10 million allocated to the programme has now been committed. OCS is assessing the impact of the current awards before deciding whether to run a third round.",0,England,NULL,NULL,Grant,United Kingdom
Big Lottery,Awards 4 All England,https://www.biglotteryfund.org.uk/global-content/programmes/england/awards-for-all-england,,,300,10000,"Awards for All gives groups a quick and easy way to get small Lottery grants of between £500 and £10,000. We want to fund projects which address the issues, needs and aspirations of local communities and people. We will fund a wide range of community projects aimed at developing skills, improving health, revitalising the local environment and enabling people to become more active citizens. You can apply at any time and you will normally hear our decision in three months.",1,England,NULL,Non-profit,Grant,United Kingdom
Big Lottery,Awards 4 All Scotland,https://www.biglotteryfund.org.uk/global-content/programmes/scotland/awards-for-all-scotland,,,300,10000,"Awards for All Scotland is an easy way for smaller organisations to get small amounts of funding.
It is focussed on organisations who have not received a grant from the programme in the last three years. 

Awards For All Scotland gives groups a chance to apply for a grant of between £500 and £10,000 for projects that aim to help improve local communities and the lives of people most in need.

You can apply to Awards For All Scotland if you are a not for profit / voluntary or community group, social enterprise, community council, school or statutory body.

We will fund a range of projects which involve bringing local people together, helping people learn, improving local spaces and getting people more active.

The programme is a partnership between the Big Lottery Fund Scotland and sportscotlandGoes to different website.

Before you submit your application to us, please read our blogGoes to different website to help make your application complete. We can only make a decision on your application when it is fully complete.",1,Scotland,NULL,Non-profit,Grant,United Kingdom
Big Lottery,Awards 4 All Wales,https://www.biglotteryfund.org.uk/global-content/programmes/wales/awards-for-all-wales,,,300,5000,"Awards for All provides voluntary and community groups with a quick and easy way to get small National Lottery grants of between £500 and £5,000 for projects which aim to help improve local communities and the lives of people most in need. 
The programme encourages a wide range of community, health, educational and environmental projects.",1,Wales,NULL,Non-profit,Grant,United Kingdom
Big Lottery,Awards 4 All Northern Ireland,https://www.biglotteryfund.org.uk/global-content/programmes/northern-ireland/awards-for-all-northern-ireland,,,300,10000,"Awards for All is a quick and easy way to get small Lottery grants of between £500 and £10,000 for projects that last for a year at most (they can be shorter).
You can apply at any time and you will normally hear our decision around 3 or 4 months after we receive your completed application.

Read the guidance notes to find more about applying. To be able to use the application form you will need an up to date version of Adobe Reader. Then you can download the application form, fill it in, save it, print it, sign it and send it back to us at this address:

Big Lottery Fund
1 Cromac Quay
Cromac Wood
Ormeau Road
Belfast
BT7 2JD

Getting in touch with us:

If you have any questions our Outreach team will be happy to help you.  We are in the office Monday to Friday from 9am to 5pm.  Ring the main office number 028 90551455 and the receptionist will put you through.

Or you can send us an email to enquiries.ni@biglotteryfund.org.uk",1,Ireland,NULL,Non-profit,Grant,United Kingdom
Unltd,Big Venture Challenge,https://unltd.org.uk/bvc/,,,0,0,"Big Venture Challenge supports ambitious social entrepreneurs with access to finance, business support and powerful connections to help them scale their ventures.
Big Venture Challenge is an intensive 12 month programme that is designed to help you raise external investment (debt or equity) of between £50,000 and £500,000. This means working with you to build a compelling growth story, finding investors, making strategic connections and supporting you as an entrepreneur during the journey.

Big Venture Challenge runs themed and regional cohorts every year in order to build deeper, more relevant strategic support networks around each cohort. In 2015 we will have two themed cohorts; Employment and Young People and Education. The regions will be the South West and the East of England.",0,England,South West,Non-profit,Support,United Kingdom
Unltd,Star People,https://unltd.org.uk/starpeople/,,,0,15000,"You are passionate about improving your community and gaining skills for yourself. You live, work, volunteer or have a business in a ‘Big Local’ area (click here for a full list). If you don’t live in one of these areas you should click here to see other support options.
You know your local area, the challenges it faces and the opportunities. You have a great idea that will be of benefit to your community.

You could be at any stage of your journey, you need some help to make sure that this is the right decision, to create a plan for how it will happen, and then to do it.

Here is how we can help:

1) Try It Awards
Offer small amounts of funding of up to £500 for individuals to try out their ideas to improve their local area. This might mean learning more about what is needed in the area or trying the project on a small scale.

2) Do It Awards
Are up to £5,000 with an average Award size of £2,500. Star People who have completed Try It Awards may now feel confident enough to be able to develop their project. Other people may come straight in at this level as they demonstrate they have the energy and skills to take forward an idea that has some project planning already in place.

3) Build It Awards
in exceptional cases we will offer up to £15,000 of funding to individuals who have an established social venture or community project or who have the potential to develop rapidly.",1,England,NULL,Non-profit,Grant,United Kingdom
Unltd,Social Switch On,https://unltd.org.uk/socialswitchon/,,,0,500,"UnLtd’s Social Switch On programme offers NCS graduates an opportunity to continue your social action journey by supporting you to use your passion, experience and knowledge to design, deliver and lead your own social ventures.
So, if you see yourself as the next big social entrepreneur, UnLtd is here to help you make the switch.

We can support you with a £500 cash Award.
We can enable you to turn your passion into a project.
We can start you off on your journey from social action to becoming a ‘social entrepreneur’.
We can help you think about earning money to live while making a social difference.",0,England,NULL,Non-profit,Grant,United Kingdom
Unltd,Appetite for Change,https://unltd.org.uk/appetiteforchange/,,,500,15000,"You live in Cornwall or Devon and you have an exciting idea that can help transform your community through foodYou have a great idea and innovative approach to growing, sharing, learning or access to quality food
Or you are an existing food based social venture based in Devon or Cornwall who wants to grow",0,England,South West,Non-profit,Grant,United Kingdom
Wales Co-op Centre,Funding Support,http://wales.coop,,,0,0,"We support Wales’ economic growth by providing a comprehensive range of services to co-operatives, mutuals, social enterprises and employee owned businesses. We have been doing so successfully for over thirty years. As well as recognising the value of co-operatives as a business model, we also believe that the principles of co-operation can be applied to the traditional business sector for the benefit of the wider economy. Co-operation can act as a business advantage. As experts in co-operation, we have a role in supporting traditional businesses to gain a co-operative advantage from applying co-operative values and principles to their businesses, for example through consortia working.",1,Wales,NULL,For-profit,Support,United Kingdom
Business Wales,Finance Locator,http://business.wales.gov.uk/zones/business-finance/funding-search-tool,,,0,0,A funding database provided by the Welsh Government with over 1000 different funds,1,Wales,NULL,For-profit,Support,United Kingdom
NI finance guide,Funding Database,http://www.investni.com/support-for-business/funding-for-business.html,,,0,0,"Here you’ll find out about the financial support we can offer in Northern Ireland to help your business start, grow,develop new products, explore new markets and improve performance.",1,Ireland,Ireland,For-profit,Support,United Kingdom
Funding Central,Funding Database,http://www.fundingcentral.org.uk/default.aspx,,,0,0,"A portal with access to over 4,000 grants, contracts and loans.",1,England,NULL,For-profit,Support,United Kingdom
Big Sociey Capital,Directory of Intermediaries,http://www.bigsocietycapital.com/finding-the-right-investment/grant,,,0,0,"There are thousands of organisations providing grant funding, all with their own priorities and criteria. The organisations and websites listed here will help you find grant funders relevant to you.
Grants might be the most appropriate way of funding some or all of your activities. But you shouldn’t think of grants simply as ‘free’ money. It is important to understand the disadvantages as well as the advantages of grant funding.",0,England,NULL,For-profit,Support,United Kingdom
EU,Access to EU Finance,http://europa.eu/youreurope/business/funding-grants/access-to-finance/search/en/,,,0,0,This site will help you to apply for loans and venture capital supported by the European Union.,1,England,NULL,For-profit,Support,United Kingdom
UK Government,Social Investment & Foundations Open Data,http://data.gov.uk/dataset/social-investment-and-foundations,,,0,0,"A list detailing social investments made by a number of UK charitable foundations. This list includes data from the following three foundations: Panahpur, The LankellyChase Foundation, and The Barrow Cadbury Trust. This data represents a snapshot of the current market.",1,England,NULL,For-profit,Support,United Kingdom
Social Impact Investment Taskforce,G8 Research Group,http://www.socialimpactinvestment.org/index.php,,,0,0,Report and research by a G8 taskforce on social entrepreneurship.,1,England,East England,NULL,Support,United Kingdom
Acorn,CDFI,http://www.findingfinance.org.uk/cdfi/acorn/,,,100,500000,"Acorn provides business loans from £100 to £500,000 across parts of the East Riding, North Yorkshire and North East Lincolnshire. It finds ways to support the financially excluded with commercial funding. Acorn looks for a viable business project which will create employment and provide a sustained benefit to the economy.",1,England,East Riding,For-profit,Loans,United Kingdom
Adage Credit,CDFI,http://www.adagecredit.co.uk,,,100,1000,"Adage credit provides personal and business loans in South London and Birmingham. Personal loans of between £100 and £1,000 are available for unanticipated outgoings, emergencies, or household expenses.",0,England,South London,For-profit,Loans,United Kingdom
ART Business Loans,CDFI,http://www.artbusinessloans.co.uk,,,10000,150000,"ART Business Loans provides business and social enterprise loans in the West Midlands. Loans from £10,000 to £150,000 are available for existing and start up businesses in all sectors where banks have been unable fully to meet their needs. ART is a pioneering finance provider, supporting job creation and preservation.",1,England,West Midlands,For-profit,Loans,United Kingdom
BBV,CDFI,http://www.bbvonline.net/index.php/finance-for-business,,,3000,50000,"BBV offers business loans of between £500 and £50,000 across the North West region. It provides financial, technical and management assistance to help local people start, run and grow their businesses. Established in 1983, BBV creates wealth and employment in the North West.",0,England,North West,For-profit,Loans,United Kingdom
BCRS Business Loans,CDFI,http://www.bcrs.org.uk,,,10000,150000,"BCRS provides business loans from £10,000 to £100,000 across the West Midlands. It lends to most sectors and targets businesses unable to get loans from traditional sources. BCRS doesn’t use impersonal computerised credit scoring and applicants can talk to one of its team to develop a loan application. It works with businesses in the following areas: West Midlands, Birmingham, Solihull, Coventry, Dudley, Sandwell, Walsall,Wolverhampton, Herefordshire, Shropshire, Staffordshire, Warwickshire, Worcestershire",1,England,West Midlands,For-profit,Loans,United Kingdom
Big Society Capital,Social Investment,http://www.bigsocietycapital.com/apply-us,,,500000,15000000,"We only invest in social investment finance intermediaries (SIFIs). SIFIs that we invest in must be registered in the UK and provide investment and other support to social sector organisations that primarily benefit people and communities in the UK. We invest in SIFIs that have a:
i) strong management team and good corporate governance systems;
ii) robust business plan and financial model with realistic underlying assumptions; and
iii) clear social mission with well-developed systems for delivering it and monitoring social impact.

We are not able to consider investment proposals from:

i) frontline social sector organisations;
ii) shell investment vehicles or ownerless orphan investment structures/funds;
iii) SIFIs investing in or providing support to social sector organisations that deliver only environmental impact;
iv) SIFIs without a clear and well-articulated social mission;
v) SIFIs without a base in the UK or which provide support to social sector organisations that primarily benefit people and communities outside the UK.",0,England,NULL,Social Finance Investment Intermediaries (SIFI),Loans,United Kingdom
UK Government,Investment & Contract Readiness Fund,http://www.beinvestmentready.org.uk/,,,50000,150000,"The £10m Investment and Contract Readiness Fund enables social ventures to access new forms of investment and compete for public service contracts.
Grants between £50,000 and £150,000 will be available on a rolling basis to ambitious social ventures who will go on to raise at least £500,000 investment, or who want to bid for contracts over £1 million.",0,England,NULL,NULL,Grant,United Kingdom
UK Government,Social Outcomes Fund,https://www.gov.uk/government/publications/social-outcomes-fund-how-to-apply,,,0,0,"The Social Outcomes Fund (SOF) is a £20m fund managed by the Cabinet Office. It aims to address one of the main problems holding up the growth of Social Impact Bonds (SIBs): the difficulty of aggregating benefits and savings which accrue across multiple public sector spending ‘silos’ in central and local government.The SOF will provide a ‘top-up’ contribution to outcomes-based commissions (Payment by Results (PbR) or SIBs) that are designed to deal with complex and expensive social issues. This will catalyse innovative new projects in areas where no single commissioner can justify making all of the outcomes payments, but where the wider benefits mean that a SIB is value for money. Reporting and assessment of performance data is a condition of funding, and will also generate evidence on the effectiveness of the project to overcome these barriers in the future. It operates only in England, with funding available to:government departments
local councils
other commissioning bodies, like police forces or the clinical commissioning groups",0,England,NULL,NULL,Grant,United Kingdom
Big Society Capital,Social Investment Council,http://www.bigsocietycapital.com/ResearchCouncil,,,0,0,"The Social Investment Research Council is a coordinated initiative which draws together research commissioners from key organisations in the social investment market from the public, private and social sectors.
The aim of the Social Investment Research Council is to help advance the UK social investment market through consolidating research efforts to generate powerful and practical insights for the benefit of social sector organisations and investors. 

The Council was launched on 31st October 2013 with Big Lottery Fund, Big Society Capital, the Cabinet Office, Citi and the City of London as founding members.

The inaugural research programme focused on improving the understanding of social investment market products and the specific investors needed to finance them. Since launch, it has published three research papers, and is currently finalising a further project (details below). 

The Council is keen to engage broadly to help ensure it addresses the most relevant issues for the social investment market. Therefore, the Council issued its first Call for Research Ideas. The Council is grateful for the broad response it has received to its Call for Research Ideas. It has published a  response and is now working on what specific projects will be commissioned.",1,England,NULL,NULL,Support,United Kingdom
UK Treasury,Enterprise Investment Tax Relief,http://www.hmrc.gov.uk/eis/,,,0,0,The Enterprise Investment Scheme (EIS) is designed to help smaller higher-risk trading companies to raise finance by offering a range of tax reliefs to investors who purchase new shares in those companies.,1,England,NULL,NULL,Legislation,United Kingdom
UK Treasury,Seed EIS,https://www.gov.uk/guidance/seed-enterprise-investment-scheme-background,,,0,0,"The Seed Enterprise Investment Scheme (SEIS) is designed to help small, early-stage companies to raise equity finance by offering a range of tax reliefs to individual investors who purchase new shares in those companies. It complements the existing Enterprise Investment Scheme (EIS) which will continue to offer tax reliefs to investors in higher-risk small companies. SEIS is intended to recognise the particular difficulties which very early stage companies face in attracting investment, by offering tax relief at a higher rate than that offered by the existing EIS.SEIS applies for shares issued on or after 6 April 2012. The rules have been designed to mirror those of EIS as it is anticipated that companies may want to go on to use EIS after an initial investment under SEIS.",1,England,NULL,NULL,Legislation,United Kingdom
UK Treasury,Social Investment Tax Relief,https://www.gov.uk/government/publications/social-investment-tax-relief-investors,,,0,0,"Social Investment Tax Relief provides a range of income and capital gains tax reliefs which can be claimed by individual investors for investments they have made in social enterprises, with a view to helping people and communities.",1,England,NULL,Individuals,Legislation,United Kingdom
Design Council,Design Council,http://www.designcouncil.org.uk/,,,0,0,In April 2014 produced a joint report into the user journey of ventures accessing social finance. We are now developing interventions based on these insights in collaboration with partners throughout the sector. Social Enterprise UK is also producing an easily accessible guide to social investment support this summer.  See the report at http://www.designcouncil.org.uk/resources/report/social-finance-uk-designing-experience-ventures,1,England,NULL,NULL,Support,United Kingdom
Social Enterprise UK,Buy Social Directory,http://buysocialdirectory.org.uk/,,,0,0,"The Buy Social Directory connects private and public sector buyers with social enterprises offering products and services. Social enterprises are businesses that trade for social and environmental purposes. They're part of a fast-growing sector, so whatever your organisation procures, there's likely to be a social enterprise that supplies it.",1,England,NULL,NULL,Support,United Kingdom
UK Government,Social Value Act,https://www.gov.uk/government/news/government-reviews-ground-breaking-social-value-act,,,0,0,"The Social Value Act improves the way taxpayers’ money is spent on public services. We are looking at experience of the Act to date and considering the benefits of extending it. The Act requires commissioners to think about how they can improve social, economic and environmental benefits when procuring services.",1,England,NULL,NULL,Legislation,United Kingdom
New Economy,Unit Cost Database,http://neweconomymanchester.com/stories/832-unit_cost_database,,,0,0,"To make it easier to set up social impact bonds, we said we would make unit cost data for public services publicly available. In March we published a unit cost database bringing together more than 600 service costs. In April we worked with Rewired State to challenge developers to use the unit cost database, to develop tools that would support local authority commissioners in commissioning early intervention services.",0,England,Manchester,NULL,Support,United Kingdom
Global Social Entrepreneurship Network,Peer to Peer Support,http://www.gsen.global,,,0,0,"The Global Social Entrepreneurship Network (GSEN) is a new platform, supported by the Cabinet Office, working with social entrepreneurs around the world. It utilises the learning, models and expertise from the UK and from all other country members who join. It will be a peer learning service for support agencies, with the potential to open out to social entrepreneurs themselves as a virtual social incubator at a future point.
Agencies supporting early stage social entrepreneurs are springing up across the world. We can all benefit from learning and sharing as well as technology transfer and this will be vital to achieve the social transformation we all want in our countries.

The secretariat coordinating the approach will be UK based and hosted initially by UnLtd, and expand out to contributions from members on a sharing economy model.",1,England,NULL,NULL,Support,United Kingdom
Global Learning Exchange,Social Impact Investing,http://gle.iipcollaborative.org/,,,0,0,"An impact investing network for the exchnage of ideas, resources and best practises.",0,England,NULL,NULL,Support,United Kingdom
Power to Change Trust,Community Fund,http://www.thepowertochange.org.uk/our-funding-programmes/,,,50000,500000,"We offer grant funding from £50,000 to £500,000. New applications should open in February 2016.
Funding is available for community businesses in England. In assessing applications we consider aspects including community control and the social, economic and environmental outcomes.

Through our funding programmes we aim to help existing community businesses thrive and encourage more people to set up businesses that provide solutions to challenges faced in local communities.",0,England,NULL,For-profit,Grant,United Kingdom
Allia Impact Finance Limited,Retail Charity Bonds,http://www.retailcharitybonds.co.uk/,,,0,0,"An issuing platform to raise medium term Loans finance for UK charities through bonds issued to retail and wholesale investors and listed on London Stock Exchange. The platform opens up a new dimension of borrowing and an alternative to bank Loans for established charities with strong credit worth. It also gives charities the opportunity to significantly raise their profile and engage with a new audience of investors. Retail Charity Bonds is an initiative of Allia, a charitable community benefit society, and has been established in association with Canaccord Genuity Limited.",1,England,NULL,NULL,Platform,United Kingdom
Co-operatives UK,Community Shares Unit,http://communityshares.org.uk/,,,0,0,"The Community Shares Unit is supported by the Department for Communities and Local Government (DCLG) and Department for Energy and Climate Change (DECC) until March 2016 and is delivered in partnership by Co-operatives UK and Locality. Modelled on the highly successful Asset Transfer Unit within Locality, the new unit works with partners to develop standards of good practice, encourage policy reforms and raise awareness to support the growth of community shares.
It acts a central reference point for market intelligence, providing the latest information on community share activities nationwide, as well as producing regularly-updated guidance materials.

The unit also operates as a dynamic hub for support, building relationships with networks and organisations to signpost communities, investors and other interested parties to the most appropriate forms of advice and assistance to develop new share offers and support existing ones.

Finally, it acts as a strong platform for profiling the community share model, raising awareness of the value of the approach to new entrants and facilitating peer support and networking to those already involved in community shares.",1,England,NULL,NULL,Support,United Kingdom
