provider,name,website,investment_term,loans_rate,min_size,max_size,focus,status,country,location,organisation_type,provider_type,region
Schwab,Foundation for Social Entreprenaurship,http://www.schwabfound.org/,,,0,0,"The Schwab Foundation for Social Entrepreneurship provides unparalleled platforms at the regional and global level to highlight and advance leading models of sustainable social innovation. It identifies a select community of social entrepreneurs and engages it in shaping global, regional and industry agendas that improve the state of the world in close collaboration with the other stakeholders of the World Economic Forum.
The Schwab Foundation searches for leading social entrepreneurs around the world. Social Entrepreneurs have been selected into the Foundation’s network after a thorough due diligence process, including outside expert reviews and site visits. Until today, the network includes over 250 social entrepreneurs.

Step 1 - Those interested in being considered as candidates complete the application form. Information gathered in the selection process will remain confidential and submit additional information such as a Curriculum Vitae, a recent evaluation report of the organization, income statements, etc.

Step 2- The Schwab Foundation and local experts review the information forms submitted by Second Round Candidates. Those who qualify are invited to be semi-finalists. At this stage, further information is gathered through site visits to the candidate's organization and/or interviews with the candidate and key informants. This due diligence step enables the selection of the finalists.

Step 3 – Finalists Selected

Step 4 – Selection Committee (Schwab Foundation Board Members) selects the winners

Step 5 - Winners are announced",1,England,NULL,For-profit,Grant,United Kingdom
Social Entrepreneurs Ireland,Impact & Elevator Funds,http://socialentrepreneurs.ie/about/our-story/,,,0,90000,"To get our best entrepreneurs working to solve our biggest societal problems, we run a series of programmes to attract the best talent to social entrepreneurship.
- An in-depth selection process to attract and select the social entrepreneurs with the most potential to bring about social impact.
- Social Entrepreneurs Bootcamp to provide support to the next generation of social entrepreneurs.
- The Elevator Programme, a 12 month support programme which supports 4-6 social entrepreneurs each year, helping them to define the problem they are trying to address and refine their solution.

Scale

We significantly increase the impact of Ireland’s highest potential social entrepreneurs through the Impact Programme, an in-depth, tailored support programme. Each year we select the 2/3 social entrepreneurs who are best placed to scale and grow, and work with them intensively for two to three years.With €100,000 in funding, the Impact Programme acts as a substantial source of capital for the projects it supports. In addition, Awardees are provided with access to in-kind supports and training, helping them to develop a detailed and robust growth plan for their projects to scale effectively.

Illuminate

To ensure that social entrepreneurs receive the practical and moral support needed to bring about change, and to foster a culture of innovation in the social sector in Ireland, we illuminate the work of social entrepreneurs around Ireland.

- We celebrate the best social entrepreneurs at our annual awards event.
- We run Ireland’s foremost community of social entrepreneurs – the Social Entrepreneurs Ireland Alumni Network.
- We engage directly with governmental, business leaders and the not-for-profit sector in Ireland.",1,Ireland,NULL,For-profit,Grant,United Kingdom
Unltd,Do It Awards,https://unltd.org.uk/doit/,,,0,5000,"You have an idea that will create social impactYou’re passionate about making this happen
You’d like some help getting started
Your Idea
It can deliver positive social impact
It meets a clear social need
It has potential to become financially sustainable
It offers you a learning experience",1,England,NULL,Individuals,Grant,United Kingdom
Unltd,Build It Awards,https://unltd.org.uk/buildit/,,,0,15000,"You are ready to grow to a local or regional scaleYou have strong local or regional networks
You have a commitment to delivering local or regional impact
Your Idea
Your venture is dynamic and successful and has been running for at least one year
You have track record of creating social impact
You have a strong vision for the long term development of your venture
Our support will help you reach the next level",0,England,NULL,Individuals,Grant,United Kingdom
Unltd,Fast Growth Awards,https://unltd.org.uk/fast-growth/,,,0,20000,"Fast Growth is an intensive accelerator programme providing £20K of grant funding and 12 months business support to entrepreneurs with ventures designed to solve social problems. Together with our partners, we help ambitious entrepreneurs scale their ventures nationally and internationally to achieve maximum social impact.",1,England,NULL,Individuals,Grant,United Kingdom
Ben & Jerry,Join Our Core,http://www.benjerry.co.uk/values/join-our-core,,,0,8000,"Ben & Jerry’s ‘Join Our Core’ competition is looking for businesses which are socially responsible and bringing about positive change in their communities Industry: Sustainable, socially responsible business Who can apply: Businesses offering products that are in long-term demand in their local area and that have a positive social impact as well as a clear environmental awareness Location: UK, Ireland, Denmark, Sweden & the Netherlands Prize: € 10,000 as well as six months of mentoring from Ashoka, 10 days of social business knowledge sharing and working with local farmers in Uganda with VSO and advertisement of your business on Ben & Jerry’s new flavour of ice cream",0,England,NULL,For-profit,Grant,Europe ex UK
Naturesave Trust,Naturesave Trust,http://www.naturesave.co.uk/the-naturesave-trust/,,,0,0,"As part of Naturesave’s environmental commitment, 10% of various insurance policies is paid directly into a trust fund, which is then used to benefit specific environmental, conservation and community renewable energy projects and charities throughout the UK. The Trust has funded hundreds of projects since it’s inception, ranging from installation of a wind turbine at a school to the conservation of water voles in Dorset.  The Trust prefers to provide start-up capital to small projects to get them going, rather than to contribute to the general administration costs of a larger charity or company.
For more information on specific projects we have funded to date, please visit Projects Funded by Naturesave Trust.

There are 2 funds: a) The Naturesave Trust & b) The Community Renewable Energy Fund",1,England,NULL,For-profit,Grant,United Kingdom
Global Social venture,Competition,http://gsvc.org/compete/overview/,,,0,30000,"The Global Social Venture Competition is the world’s preeminent social venture competition providing aspiring entrepreneurs with mentoring, exposure, and $50,000 in prize money to transform their business ideas into positive real-world impact. 
GSVC leads entrant teams through an experiential learning process to develop innovative, scalable solutions to the world’s greatest challenges.  Through our global network of 13 partner schools and competitions, we give teams the connections, support, and exposure needed to advance their social ventures.
 
The competition occurs over three rounds. The first two rounds are run through the GSVC global partner schools and competitions. During each round of the competition, social entrepreneurs present the social, financial, and environmental values of their business, gaining valuable feedback from and exposure to some of the greatest minds in social innovation.",0,England,NULL,For-profit,Grant,United Kingdom
School for Social Entrepreneurs,Social Start Up Programmes,https://www.the-sse.org/our-courses/,,,0,0,"Our programmes are comprehensive and generally last at least 6 days. Programmes cover topics such as starting a social enterprise, scaling, replication, and moving an existing charity towards a social enterprise model. If you’re looking for something shorter take a look at our workshops.
Current programmes are:

a) Transition to Trading
b) Start Up: Lloyds Bank Social Entrepreneurs Programme
c) Replication and Social Franchising
d) Start Up: Fellowship",1,England,NULL,For-profit,Support,United Kingdom
Local Partnerships,Technology Spin Outs  Fund,https://www.bigsocietycapital.com/what-we-do/investor/investments/technology-spin-out-fund,,,250000,1000000,This new initiative will enable public sector spin-outs access loans of between £250 thousand and £1 million for investment in technology to improve services in health and social care.,1,England,NULL,For-profit,Loans,United Kingdom
NESTA Investment Management,Impact Investment Fund,http://www.nestainvestments.org.uk/,,,0,0,"We want to see the power of innovation and technology used to solve major social problems, bringing the benefits of innovation to everyone in society. We help to do this by investing in ventures with inclusive and scalable innovations that are run by outstanding entrepreneurs. We are an experienced team of sector experts, venture capitalists, impact investors and evaluators backed by a strong, innovative institution - Nesta.Committed to supporting outstanding entrepreneurs, we bring the skills, networks and resources of our team and from across Nesta, to support social ventures to deliver on their mission. We are currently seeking innovations that tackle the major challenges faced by older people, children and communities in the UK.",1,England,NULL,For-profit,Loans,United Kingdom
PURE Leapfrog,Community Energy Financing,http://www.pureleapfrog.org/page.jsp?id=76,7,,10000,250000,"Pure Leapfrog is the leading provider of social investment to community energy projects in the UK.
We provide affordable finance to community-led projects across the UK to help fund the installation of renewable energy technologies and energy efficiency measures. Today Pure Leapfrog manages the Community Energy Fund and, through Leapfrog Finance Ltd, we provide Bridge Finance to community energy groups.

As impact investors, we seek to maximise the social and environmental benefit achieved by the projects we fund. Our ambition, measured in terms of the social and environmental benefits generated by the projects we finance, is to develop the sectors most successful financial platform.

Community Energy Fund

Our Community Energy Fund draws on a credit facility from Big Society Capital, whilst funders and sponsors contribute to it through donations. The fund provides small to medium loans to UK community renewable energy and energy efficiency projects. So far we have provided 22 loans to projects totalling £1,174,028.

Bridge Finance

Our bridge fund is a £15 million revolving loan facility from BSC to support large scale community energy projects.

The facility is managed by Leapfrog Finance Ltd and is able to provide equity and construction finance. The fund is designed to enable community groups to acquire and/or construct renewable energy projects under the government’s Shared ownership protocol.",1,England,NULL,Non-profit,Loans,United Kingdom
Ananda Ventures,Social Venture Fund II,http://www.socialventurefund.com/en/#investment-criteria,,,300000,1500000,"The Social Venture Fund invests in social enterprises, which have innovative and entrepreneurial driven solutions for urgent social and environmental challenges. The Social Venture Fund’s goal: To return the invested capital for future investments. This way, the power of the capital and not the capital itself is used for a positive impact.  We are always looking for exceptional social entrepreneurs from all around the world. Ventures, which are supported by the Social Venture Fund, must have proven success on the market (proof-of-concept) and also be willing and able to expand. The guidelines as to how we evaluate a venture can be found under the section “INVESTMENT CRITERIA”",1,England,NULL,For-profit,Loans,United Kingdom
Co-operative & Community Finance,Loan Fund,http://www.coopfinance.coop/borrow/,,,10000,150000,"We lend to organisations that are owned and democratically controlled by their members, who are usually either employees, customers or members of a community.Loans from £10,000 to £75,000 are readily available, and we are able to lend up to £150,000 using other funds. We do not require personal guarantees.

We manage a range of loan funds throughout the UK, and currently have around £4m available to lend.  Our staff will be glad to advise on the availability of specific funds and the most suitable forms of finance for your business.",1,England,NULL,For-profit,Loans,United Kingdom
Ignite,Energy Impact Investment Fund,http://ignitesocialenterprise.com/,,,50000,2000000,"We invest people and money into emerging and mature organisations that have a clear vision of how they benefit society. By focusing on energy, we’re driving innovation at every point of the energy chain – from sourcing and generation through to supply, service and saving energy. And by investing in social enterprises we’re making a positive impact on employment, income, housing and local communities.
As well as providing capital, we work to understand the specific needs of each of our investments and help them grow through mentorship, networking and the skilled support of Centrica employees.

Thanks to our backing from Centrica, we’re providing funding of £10 million over the next ten years, and will make investments in the UK of between £50k and £2m. To be eligible for funding and support your business must:

Be in the energy or energy-related sector
Have the potential to make a real social impact in the UK
Be seeking a minimum of £50k of Loans or equity investment
Fulfill a clear social need and demand
Have clear outputs and goals",1,England,NULL,For-profit,Loans,United Kingdom
RBS,Microfinance Fund,http://www.inspiringenterprise.rbs.com/inspiring-social/microfinance-fund,,,30000,750000,"RBS has a strong heritage supporting community-based businesses. Through RBS Social & Community Capital (S&CC), we are building on that support, helping potential and existing social entrepreneurs who are unable to access sufficient finance through mainstream channels.
We will look to support viable charities, social enterprises, community interest companies and co-operatives who are sustainable, deliver high levels of social value and are investment ready.

Through our independent charity RBS Social & Community Capital is offering Loan Funding of between £30,000 and £750,000 depending on the type of organisation, to enable Social Enterprises to gain the finance they need to expand their market.

There is no deadline to apply, and applications for loan funding are open all year round.",0,England,NULL,For-profit,Loans,United Kingdom
Ulster Community,Investment Trust,http://www.ucitltd.com/,,,0,0,"Ulster Community Investment Trust Ltd (UCIT) was established in 1995 in response to decreasing grant support from government and the difficulties experienced by community organisations in accessing commercial loan facilities. The organisation now stands as the key provider of social finance, free advice, business support and mentoring to the social economy sector in Northern Ireland and the Republic of Ireland. Ulster Community Investment Trust (UCIT) is a Charity which provides loans exclusively to other third sector organisations such as community groups, charities, sports clubs and social enterprises in Northern Ireland. Since 2001 we’ve committed in excess of £50 million to over 360 organisations in Northern Ireland and the Republic of Ireland.",1,Ireland,NULL,For-profit,Loans,United Kingdom
Bethnal Green Ventures,Social Incubator,http://bethnalgreenventures.com/apply,,,0,15000,"Bethnal Green Ventures is an accelerator programme for people who want to change the world using technology.We invest in and support great teams with new ideas to help build solutions to social and environmental problems through an intensive three-month programme. Bethnal Green Ventures seeks out people with great ideas: they might be software developers, designers or people with personal experience of something they want to change – from teachers and doctors, to patients and carers. We look for very early-stage ideas – not business plans – and we’re more interested in potential than experience.
We select teams of between two and four people to be part of the Bethnal Green Ventures programme. We invest £15,000 in each team in exchange for 6% equity. We provide three month programme of support and advice to help build, test and launch each startup.",1,England,London,For-profit,Equity,United Kingdom
Responsible Finance,Start up loans,http://responsiblefinance.org.uk/funding-innovation/start-up-loans/,5,6%,0,25000,Provising start up loans for businesses across the UK.  Need to apply to local partner.,1,England,NULL,For-profit,Loans,United Kingdom
Responsible Finance,Coalfield Investment Coalition,http://responsiblefinance.org.uk/cic/,,,0,0,"We are partnering with the Coalfields Regeneration Trust (CRT) to deliver a new start up loan fund dedicated to coalfield communities. The fund has been created by bringing together funding from CRT and the Start Up Loans Company.
The fund enables people living in former mining communities to access loans and support to start up their own business. The package of support and mentoring and terms mirror those of Start Up Loans.

Coalfield Start Ups will be made available across the six English coalfield regions. These loans are available from a number of our members:

Business Enterprise Fund (Yorkshire and the North East)
Business Finance Solutions (North West)
Coventry and Warwickshire Reinvestment Trust (West Midlands)
Finance For Enterprise  (Yorkshire)
Let’s Do Business Finance (South East)
MCF Loans (East and West Midlands)
Merseyside Special Investment Fund (North West)
Northern Pine Trees (North East)",1,England,Business Enterprise Fund (Yorkshire and the North East),For-profit,Loans,United Kingdom
Business Enterprise Fund,Start Up Finance,http://www.befund.org/,3,6%,250,0,Provising start up loan finance for businesses in Yorkshire and the North East,1,England,Calderdale,For-profit,Loans,United Kingdom
Coventry & Warwickshire Reinvestment Trust,Start up loans,http://www.cwrt.uk.com/,3,6%,1000,75000,"CWRT is a not-for-profit organisation committed to supporting individuals and businesses in Coventry and Warwickshire to start, grow and develop by providing business loans to those that have been unable to raise sufficient, if any, funding from their bank.
Whether you are looking for start up funding, additional working capital, support towards capital expenditure, obtaining new premises or looking to invest in people, we can lend between £1,000 and £75,000 to individuals and businesses who need an alternative source of finance to start up or grow a business.

By offering loans and business support to individuals and existing businesses in Coventry and Warwickshire, CWRT hope to fill the gaps in mainstream lending, addressing market failures and benefit the local community – this might be in terms of jobs created, local services provided or by helping provide finance for a charity or community group.",1,England,Coventry,For-profit,Loans,United Kingdom
DSL Business Finance,SME & Start up loans,http://www.dsl-businessfinance.co.uk/content/loans_for_businesses/,,,0,50000,"In these tough economic times small firms are finding it much harder to obtain finance for their business. Many of them are turning away from mainstream lenders, towards DSL Business Finance for loans which will help them set-up, expand and create jobs.
We offer:-

- Business Loans to enterprises located in Scotland
- Loans up to £50,000
- Knowledge that any profit we make, will not be paid out in bonuses to shareholders
- We reinvest any profit back into our loan funding to help revive local communities
- Aftercare support to all client for the duration of the loan",1,Scotland,Scotland,For-profit,Loans,United Kingdom
Enterprise Northern Ireland,Start up loans,https://www.enterpriseni.com/what-we-do/loan-funding,5,6%,0,10000,"The Northern Ireland Small Business Loan Fund (www.nisblf.com) is part of Invest NI's Access to Finance Strategy. The fund provides unsecured loans to social enterprises and SMEs in the micro enterprise sector in the start up and growth phases.
The fund helps to bridge gaps where other funding options have been exhausted. Loans to recipients are in the £1k - £50k range. ENI works alongside Ulster Community Investment Trust (UCIT) as fund managers. During 2013 loans to the value of £0.5m were processed for 21 businesses.

- See more at: https://www.enterpriseni.com/what-we-do/loan-funding#sthash.fjmKClK3.dpuf",0,Ireland,Northern Ireland,For-profit,Loans,United Kingdom
Finance for Enterprise,Start up loans,http://finance-for-enterprise.co.uk/,5,6%,0,25000,"Finance For Enterprise is the local delivery partner for Start Up Loans, a Government backed national initiative aimed at ambitious people who want to start up their own businesses or have recently started to trade and are still in the start-up phase (up to 24 months). Applicants don’t just get financial help – they also get business support.",1,England,South Yorkshire,For-profit,Loans,United Kingdom
Foundation East,Start up loans,http://www.foundationeast.org/,,6-19%,0,100000,"If you have a viable business idea but need funding and some advice to make your entrepreneurial dream come true, get more equipment to grow your company, need some working capital to help with cash flow or to take on an apprentice to expand your services – we may be able to help.
Our business loan customers are sole traders, limited companies, social enterprises and voluntary organisations. The legal form of your business is not a deciding factor in our process of reviewing applications.By contrast, the qualities and skills of person behind the business is crucial.

Unfortunately, there are many people with good business ideas or established businesses who are unable to access finance from mainstream banks. The reasons why may include a lack of a trading history, a lack of assets to use as security, an insufficiently strong credit rating or even the business sector in which they trade.",1,England,East England,For-profit,Loans,United Kingdom
HBV Enterprise,Start up Business Support,http://www.hbv.org.uk/,,,0,,"Looking for loan finance or support to get started or grow? Based in Hackney, Camden, City of London, Haringey, Islington, Newham, Tower Hamlets or Waltham Forest?
Start Up Loans are a UK-wide, government backed scheme which offers a repayable loan to individuals who have a viable business idea. The scheme funds businesses in every sector. As well as financial backing all loan recipients are given access to a mentor, free training events and exclusive business offers.

HBV Enterprise is part of a network of official delivery partners who administer the scheme. We guide you through the application process, including creating a business plan and cash flow forecast. If you receive a loan we will then support you through your journey.",0,England,Hackney,For-profit,Loans,United Kingdom
Impetus,Start up loans,http://www.impetus-marches.co.uk/,3,6%,500,25000,"If you are a West Midland entrepreneur and keen to start-up a new business or expand a young one – here’s some good news.
If you have a great business idea and require a loan (or you have a business under two year old requiring financial support) then Impetus can help.",1,England,Shropshire,For-profit,Loans,United Kingdom
Impetus,Business Loans,http://www.impetus-marches.co.uk/our-funds/,,14%,0,150000,"Impetus has general capital funds for Gloucestershire, Herefordshire, Worcestershire, Shropshire, Telford & Wrekin and the wider West Midlands area.  In 2014/15 we have in the region of £4 million to lend.
We have teamed up with our Local Authorities and other government and non-government partners to create the following additional sources of finance:

a) Regional growth Fund: Loans of up to £150,000 are now available to businesses in the West Midlands and Gloucestershire.
b) Worcestershire Small Business Loan Fund: With the support of Worcestershire County Council and the Local Economic Partnership the Worcestershire Small Business Loan Fund has been set up and delivers up to £2million of loans each year.
c) Worcester City Business Loan Fund: Worcester City Council and Impetus have created a £100,000 fund to support businesses who operate and create or support jobs in Worcester City.
d) Shropshire Small Business Loan Fund: Shropshire Council and Impetus have teamed up to create £2.2million loan fund for 2012 to 2015
e) Telford & Wrekin Small Business Loan Fund: Impetus teamed up with Telford & Wrekin Council to created a £400,000 pilot loan fund for 2012/13.  This was in additional to our current lending activity to date in the Telford & Wrekin area. Although this fund is now closed we are still making loans in the area.",1,England,Shropshire,For-profit,Loans,United Kingdom
Lancashire Community Finance,Start up loans,http://www.lancashirecommunityfinance.co.uk/,3,6%,250,0,Provising start up loans for businesses in Lancashire,1,England,Lancashire,For-profit,Loans,United Kingdom
